{
  "$schema": "https://json-schema.org/draft/2020-12/schema",
  "$id": "https://truchas.org/schema/vof_2d.schema.json",
  "title": "Truchas 2D VOF simulation input",
  "description": "Complete input for a two-dimensional volume-of-fluid advection simulation with a prescribed velocity field.",
  "type": "object",
  "properties": {
    "mesh": {
      "$ref": "../../mesh/mesh_2d.schema.json",
      "description": "Two-dimensional mesh definition."
    },
    "vof-model": {
      "$ref": "#/$defs/vof-model",
      "description": "VOF tracking algorithm, geometry mode, and prescribed velocity."
    },
    "initial-regions": {
      "$ref": "../../material_distribution/region_func.schema.json",
      "description": "Named geometric regions used to initialize one volume-fraction component per region. Region order determines the component order."
    },
    "initial-region-refinement-level": {
      "type": "integer",
      "minimum": 0,
      "default": 6,
      "description": "Maximum recursive refinement level used to estimate initial region volume fractions. The default is 6."
    },
    "sim-control": {
      "$ref": "vof_sim_control.schema.json",
      "description": "Fixed VOF time-step and output controls."
    }
  },
  "required": ["mesh", "vof-model", "initial-regions", "sim-control"],
  "additionalProperties": false,
  "$defs": {
    "vof-model": {
      "title": "VOF model",
      "type": "object",
      "properties": {
        "algorithm": {
          "enum": ["simple", "geometric"],
          "default": "geometric",
          "description": "Volume-fraction tracking algorithm. The geometric algorithm reconstructs bounded material volumes; the simple algorithm transports face fluxes directly. The default is geometric."
        },
        "axisymmetric": {
          "type": "boolean",
          "default": false,
          "description": "Interpret the 2D mesh as an axisymmetric r-z mesh when computing volumes and fluxes. The default is false."
        },
        "velocity": {
          "$ref": "../../core/vector_func.schema.json",
          "description": "Prescribed velocity field. It may be a numeric vector or an inline vector-function definition, and must evaluate to exactly two components."
        }
      },
      "required": ["velocity"],
      "additionalProperties": false
    }
  }
}
